{
  "approval": {
    "approved_census_id": null,
    "requested_at": null,
    "responsible_actor": "product-owner",
    "status": "pending"
  },
  "census_id": "sha256:7b31b81a709ef879c17db52082e538336381ddac0dc2cef4a866f34debadf48c",
  "configured_roots": [
    "/Volumes/Dev/Sites"
  ],
  "dependencies": [
    {
      "required_for_approval": true,
      "status": "completed",
      "task": "TASK-281"
    },
    {
      "required_for_approval": true,
      "status": "completed",
      "task": "TASK-295"
    },
    {
      "required_for_approval": true,
      "status": "in_progress",
      "task": "TASK-297"
    }
  ],
  "mode": "read-only",
  "observed_at": "2026-08-12T18:15:00Z",
  "privacy": {
    "content_captured": false,
    "git_paths_captured": false,
    "machine_identity_captured": false,
    "note": "Exact repository roots are required; file names, Git remotes, branches, status paths, identities, tokens, and project content are not recorded.",
    "secret_values_captured": false
  },
  "repositories": [
    {
      "approval_status": "pending",
      "eligible": false,
      "entitlement": {
        "evidence": [],
        "state": "not-required"
      },
      "exclusions": [
        {
          "code": "non-solution-class",
          "reason": "Classification DOCS-KNOWLEDGE is outside solution-project fan-out.",
          "source": "classification"
        }
      ],
      "product_families": [
        "claude",
        "codex"
      ],
      "proposed_operation": {
        "kind": "none",
        "plan": null
      },
      "reason": "Classification DOCS-KNOWLEDGE is outside solution-project fan-out.",
      "repo_class": "DOCS-KNOWLEDGE",
      "repo_identity": "sha256:d4e5f129ba6e172add16b780a8015190d625b72379798a979c19272f30728545",
      "repo_path": "/Volumes/Dev/Sites/COPILOT/BM",
      "responsible_actor": "none",
      "tier_role": "none",
      "workspace_state": {
        "ambiguity": false,
        "ambiguity_reasons": [],
        "customization": "not-detected",
        "dirty_entry_count": 0,
        "git": "clean",
        "mismatched_managed_count": 0,
        "missing_managed_count": 0
      }
    },
    {
      "approval_status": "pending",
      "eligible": false,
      "entitlement": {
        "evidence": [],
        "state": "not-required"
      },
      "exclusions": [
        {
          "code": "non-solution-class",
          "reason": "Classification SCRATCH-ARCHIVE is outside solution-project fan-out.",
          "source": "classification"
        },
        {
          "code": "git-root-unavailable",
          "reason": "The exact path is not a safe readable Git repository root.",
          "source": "census-safety"
        },
        {
          "code": "ambiguous-state",
          "reason": "The collector could not prove a safe deterministic project state.",
          "source": "census-safety"
        }
      ],
      "product_families": [],
      "proposed_operation": {
        "kind": "none",
        "plan": null
      },
      "reason": "Classification SCRATCH-ARCHIVE is outside solution-project fan-out.; The exact path is not a safe readable Git repository root.; The collector could not prove a safe deterministic project state.",
      "repo_class": "SCRATCH-ARCHIVE",
      "repo_identity": "sha256:25f5c906a56d33f4df73c8c8bd0c909a1cdb1daee52ce260b1caa6f7224f07b6",
      "repo_path": "/Volumes/Dev/Sites/COPILOT/MBS",
      "responsible_actor": "none",
      "tier_role": "none",
      "workspace_state": {
        "ambiguity": true,
        "ambiguity_reasons": [
          "not-a-git-repository"
        ],
        "customization": "not-applicable",
        "dirty_entry_count": 0,
        "git": "unavailable",
        "mismatched_managed_count": 0,
        "missing_managed_count": 0
      }
    },
    {
      "approval_status": "pending",
      "eligible": false,
      "entitlement": {
        "evidence": [],
        "state": "not-required"
      },
      "exclusions": [
        {
          "code": "non-solution-class",
          "reason": "Classification SCRATCH-ARCHIVE is outside solution-project fan-out.",
          "source": "classification"
        },
        {
          "code": "git-root-unavailable",
          "reason": "The exact path is not a safe readable Git repository root.",
          "source": "census-safety"
        },
        {
          "code": "ambiguous-state",
          "reason": "The collector could not prove a safe deterministic project state.",
          "source": "census-safety"
        }
      ],
      "product_families": [],
      "proposed_operation": {
        "kind": "none",
        "plan": null
      },
      "reason": "Classification SCRATCH-ARCHIVE is outside solution-project fan-out.; The exact path is not a safe readable Git repository root.; The collector could not prove a safe deterministic project state.",
      "repo_class": "SCRATCH-ARCHIVE",
      "repo_identity": "sha256:ef216ab6ceb9da90cca47b26b1af2e72de47be4ba9afa45cd8830cddf20e8712",
      "repo_path": "/Volumes/Dev/Sites/COPILOT/_archive",
      "responsible_actor": "none",
      "tier_role": "none",
      "workspace_state": {
        "ambiguity": true,
        "ambiguity_reasons": [
          "not-a-git-repository"
        ],
        "customization": "not-applicable",
        "dirty_entry_count": 0,
        "git": "unavailable",
        "mismatched_managed_count": 0,
        "missing_managed_count": 0
      }
    },
    {
      "approval_status": "pending",
      "eligible": false,
      "entitlement": {
        "evidence": [],
        "state": "dependency-pending"
      },
      "exclusions": [],
      "product_families": [
        "claude",
        "codex"
      ],
      "proposed_operation": {
        "kind": "refresh-after-dependencies",
        "plan": null
      },
      "reason": "Refresh after TASK-295 and TASK-297 complete; no mutation plan or approval exists.",
      "repo_class": "PRODUCT",
      "repo_identity": "sha256:584a2b828e94e55fa143f0607a35a6b3a6e491e78b93c68419ee57e2e952db7b",
      "repo_path": "/Volumes/Dev/Sites/COPILOT/admin-server",
      "responsible_actor": "delivery-owner",
      "tier_role": "none",
      "workspace_state": {
        "ambiguity": false,
        "ambiguity_reasons": [],
        "customization": "not-detected",
        "dirty_entry_count": 0,
        "git": "clean",
        "mismatched_managed_count": 0,
        "missing_managed_count": 0
      }
    },
    {
      "approval_status": "pending",
      "eligible": false,
      "entitlement": {
        "evidence": [],
        "state": "not-required"
      },
      "exclusions": [
        {
          "code": "component-authoring-tree",
          "reason": "Tier/component authoring trees are outside project fan-out.",
          "source": "classification"
        },
        {
          "code": "dirty-working-tree",
          "reason": "Active work is held and must never be changed by fan-out.",
          "source": "census-safety"
        }
      ],
      "product_families": [
        "claude"
      ],
      "proposed_operation": {
        "kind": "none",
        "plan": null
      },
      "reason": "Tier/component authoring trees are outside project fan-out.; Active work is held and must never be changed by fan-out.",
      "repo_class": "COMPONENT",
      "repo_identity": "sha256:df1628e6e7ff16b5f1e599f9afa5191c623fadfe50329f6da193c17755f453a5",
      "repo_path": "/Volumes/Dev/Sites/COPILOT/claude-copilot",
      "responsible_actor": "none",
      "tier_role": "foundation",
      "workspace_state": {
        "ambiguity": false,
        "ambiguity_reasons": [],
        "customization": "not-detected",
        "dirty_entry_count": 46,
        "git": "dirty",
        "mismatched_managed_count": 0,
        "missing_managed_count": 0
      }
    },
    {
      "approval_status": "pending",
      "eligible": false,
      "entitlement": {
        "evidence": [],
        "state": "not-required"
      },
      "exclusions": [
        {
          "code": "component-authoring-tree",
          "reason": "Tier/component authoring trees are outside project fan-out.",
          "source": "classification"
        }
      ],
      "product_families": [
        "claude"
      ],
      "proposed_operation": {
        "kind": "none",
        "plan": null
      },
      "reason": "Tier/component authoring trees are outside project fan-out.",
      "repo_class": "COMPONENT",
      "repo_identity": "sha256:dfa765f21720061e8b6ea81c6fe7754c2309b9ea00659bf222f5c9da724a7390",
      "repo_path": "/Volumes/Dev/Sites/COPILOT/claude-copilot-accounting",
      "responsible_actor": "none",
      "tier_role": "department",
      "workspace_state": {
        "ambiguity": false,
        "ambiguity_reasons": [],
        "customization": "not-detected",
        "dirty_entry_count": 0,
        "git": "clean",
        "mismatched_managed_count": 0,
        "missing_managed_count": 0
      }
    },
    {
      "approval_status": "pending",
      "eligible": false,
      "entitlement": {
        "evidence": [],
        "state": "not-required"
      },
      "exclusions": [
        {
          "code": "component-authoring-tree",
          "reason": "Tier/component authoring trees are outside project fan-out.",
          "source": "classification"
        }
      ],
      "product_families": [
        "claude"
      ],
      "proposed_operation": {
        "kind": "none",
        "plan": null
      },
      "reason": "Tier/component authoring trees are outside project fan-out.",
      "repo_class": "COMPONENT",
      "repo_identity": "sha256:47f682166e29bb9fd02a21af33b878f74542565a261c2d642c9190c768288f63",
      "repo_path": "/Volumes/Dev/Sites/COPILOT/claude-copilot-internal",
      "responsible_actor": "none",
      "tier_role": "organization",
      "workspace_state": {
        "ambiguity": false,
        "ambiguity_reasons": [],
        "customization": "not-detected",
        "dirty_entry_count": 0,